{
  "schema_version": 1,
  "generator": "freview agent-orchestrated Full Review (Antigravity CLI agy 1.4.0 + Gemini 3.8 Flash)",
  "report_kind": "partial-audit",
  "timestamp_utc": "2026-10-16T21:35:00Z",
  "mode_requested": "full",
  "scope": {
    "included": [
      "git",
      "tracking",
      "implementation",
      "ci",
      "releases",
      "docs",
      "community",
      "dependencies",
      "security-posture",
      "accessibility",
      "code-review"
    ],
    "excluded": [
      "security-scan"
    ],
    "specialists": {
      "code-review": "native-read-only-bounded",
      "security-scan": "not-selected"
    },
    "coverage": "Full-mode repository audit across Git, tracking, implementation, CI, releases, docs, community, dependencies, security-posture, accessibility, and native code review. Executed on Samsung T7 Shield external storage with Python 3.14.8 under Antigravity CLI environment."
  },
  "repository": {
    "root": "/Volumes/T7Tmp/ai-dev/worktrees/freview",
    "remote": "https://github.com/raiseCatError/freview",
    "identity": "forge:github.com/raisecaterror/freview",
    "base_ref": "main",
    "base_sha": "7e20912d068be8cc8a14f7ac64b082404fce790d",
    "head_sha": "81411193b6d23dac74ecc5097032c622a4cf8403"
  },
  "findings": [
    {
      "id": "FR-01",
      "severity": "P1",
      "category": "releases",
      "summary": "Scheduled consumer workflow pointed to an undocumented helper location",
      "status": "resolved",
      "evidence": [
        "The optional consumer template previously used .freview/tools/repo_snapshot.py; corrected in PR #5 (commit 05cc3c8).",
        "templates/github-actions/freview-daily.yml",
        "Merged commit bff54634d375defea97b0f19fc3b4a35cd7fc882 (PR #5)"
      ],
      "next_action": "Retain consumer workflow referencing .agents/skills/freview/scripts/repo_snapshot.py",
      "remediation": {
        "summary": "Retain consumer workflow referencing .agents/skills/freview/scripts/repo_snapshot.py",
        "steps": [
          "Verify templates/github-actions/freview-daily.yml points to .agents/skills/freview/scripts/repo_snapshot.py",
          "Ensure consumer workflow fails cleanly if skill is not installed"
        ],
        "verification": [
          "Executed python3 -m unittest discover -s tests -v (test_bundled_assets_match_repository_documents passed)"
        ],
        "confidence": "high",
        "owner": "maintainer",
        "prerequisites": [],
        "risks": [],
        "estimated_effort": "small",
        "requires_approval": true
      }
    },
    {
      "id": "FR-02",
      "severity": "P1",
      "category": "dependencies",
      "summary": "Root npm metadata followed external symlinks or could read oversized files",
      "status": "resolved",
      "evidence": [
        "Manifest and lockfile reads previously used is_file()/read_text() without symlink refusal or byte caps; guarded in PR #5 (commits 03374d7 and 7a86c3a).",
        "skills/freview/scripts/repo_snapshot.py",
        "tests/test_repo_snapshot.py (test_symlinked_npm_metadata_is_not_read, test_oversized_npm_metadata_is_not_read)"
      ],
      "next_action": "Maintain symlink refusal and 2MB/16MB byte caps on package.json/package-lock.json",
      "remediation": {
        "summary": "Maintain symlink refusal and 2MB/16MB byte caps on package.json/package-lock.json",
        "steps": [
          "Preserve symlink rejection and size checks in repo_snapshot.py",
          "Return status unknown rather than clean if files exceed bounds"
        ],
        "verification": [
          "python3 -m unittest tests.test_repo_snapshot.SnapshotTests.test_symlinked_npm_metadata_is_not_read",
          "python3 -m unittest tests.test_repo_snapshot.SnapshotTests.test_oversized_npm_metadata_is_not_read"
        ],
        "confidence": "high",
        "owner": "maintainer",
        "prerequisites": [],
        "risks": [],
        "estimated_effort": "small",
        "requires_approval": true
      }
    },
    {
      "id": "FR-03",
      "severity": "P1",
      "category": "tracking",
      "summary": "Duplicate-work candidate output was unbounded",
      "status": "resolved",
      "evidence": [
        "Pairwise title comparison could emit quadratic candidate pairs; bounded in PR #5 (commits 57c1227 and 1d859ec) with --max-pairs cap and candidate_cap_reached flag.",
        "skills/freview/scripts/duplicates.py",
        "tests/test_duplicates.py (test_candidate_output_cap_preserves_unverified_status)"
      ],
      "next_action": "Preserve default 200 pair cap and explicit candidate-unverified status",
      "remediation": {
        "summary": "Preserve default 200 pair cap and explicit candidate-unverified status",
        "steps": [
          "Enforce max_pairs bounded between 1 and 5000 in duplicates.py",
          "Maintain clear disclosure when output is truncated"
        ],
        "verification": [
          "python3 -m unittest tests.test_duplicates.DuplicateTests.test_candidate_output_cap_preserves_unverified_status"
        ],
        "confidence": "high",
        "owner": "maintainer",
        "prerequisites": [],
        "risks": [],
        "estimated_effort": "small",
        "requires_approval": true
      }
    },
    {
      "id": "FR-04",
      "severity": "P2",
      "category": "tracking",
      "summary": "JSON report comparison could accept two reports with no repository identity",
      "status": "resolved",
      "evidence": [
        "identity(before) == identity(after) evaluated true when both were None; guarded in PR #5 (commits e799a16 and 29a3966).",
        "skills/freview/scripts/report_tools.py",
        "tests/test_report_tools.py (test_missing_repository_identity_never_compares_as_equal)"
      ],
      "next_action": "Enforce non-empty stable identity check in report_tools.py",
      "remediation": {
        "summary": "Enforce non-empty stable identity check in report_tools.py",
        "steps": [
          "Raise ValueError if neither report contains a stable identity string",
          "Require matching forge identity or common gitdir"
        ],
        "verification": [
          "python3 -m unittest tests.test_report_tools.ReportTests.test_missing_repository_identity_never_compares_as_equal"
        ],
        "confidence": "high",
        "owner": "maintainer",
        "prerequisites": [],
        "risks": [],
        "estimated_effort": "small",
        "requires_approval": true
      }
    },
    {
      "id": "FR-05",
      "severity": "P2",
      "category": "docs",
      "summary": "Runtime project-policy bounds differed from published schema",
      "status": "resolved",
      "evidence": [
        "project_type length, categories maxItems and release branch regex were previously misaligned; synchronized in PR #5 (commits 57cfb8f, e99711e, e185017).",
        "skills/freview/scripts/review.py",
        "schemas/freview-config.schema.json",
        "tests/test_review_cli.py"
      ],
      "next_action": "Keep review.py policy validation aligned with freview-config.schema.json",
      "remediation": {
        "summary": "Keep review.py policy validation aligned with freview-config.schema.json",
        "steps": [
          "Ensure schema and code agree on constraints",
          "Retain packaging test test_bundled_assets_match_repository_documents"
        ],
        "verification": [
          "python3 -m unittest tests.test_skill_layout.SkillLayoutTests.test_bundled_assets_match_repository_documents"
        ],
        "confidence": "high",
        "owner": "maintainer",
        "prerequisites": [],
        "risks": [],
        "estimated_effort": "small",
        "requires_approval": true
      }
    },
    {
      "id": "FR-06",
      "severity": "P1",
      "category": "ci",
      "summary": "Full mode physical multi-agent acceptance matrix is partially verified",
      "status": "partial",
      "evidence": [
        "Agent doctor implemented in PR #6. Antigravity CLI (agy 1.4.0) exercised with all unit tests passing on physical host with T7 external storage (65 tests on baseline 7e20912; 67 tests on tested revision 8141119).",
        "Claude Code (account2) was independently confirmed to physically load freview via its native Skill tool and execute a Quick-mode smoke test on NMSh, reproducing the pre-PR#7 Python -I failure.",
        "Full-mode physical command execution remains to be run on Codex and OpenCode host environments.",
        "Paid/hosted review plugins (Claude Code Review / OpenAI Codex PR review) remain uninvoked by policy."
      ],
      "next_action": "Execute physical acceptance test runs across Codex and OpenCode runtimes",
      "remediation": {
        "summary": "Execute physical acceptance test runs across Codex and OpenCode runtimes",
        "steps": [
          "Run agent_doctor.py and review.py inside each agent's native environment",
          "Verify per-category verification_manifest in each agent's generated report",
          "Validate against schemas/freview-report.schema.json"
        ],
        "verification": [
          "Collect invocation logs, exit codes, exact commit SHAs, and JSON reports from each agent"
        ],
        "confidence": "high",
        "owner": "maintainer",
        "prerequisites": [],
        "risks": [],
        "estimated_effort": "medium",
        "requires_approval": true
      }
    },
    {
      "id": "FR-07",
      "severity": "P2",
      "category": "community",
      "summary": "GitHub repository metadata and contribution templates are missing",
      "status": "observed",
      "evidence": [
        "GitHub repository description is empty on https://github.com/raiseCatError/freview.",
        "No .github/ISSUE_TEMPLATE directory or .github/pull_request_template.md file exists in the repository tree."
      ],
      "next_action": "Add a concise repository description and standard issue/PR templates when authorized",